index,label_en,label_zh,r,g,b,a
697,Central sulcus mid-superior RH,中央沟中部上侧右侧,103,92,242,255
698,Thalamus antero-superior,丘脑前上部,104,92,242,255
699,Superior frontal gyrus anterior,上额回前部,105,92,242,255
700,Supramarginal gyrus anterior LH,缘上回前部左侧,106,92,242,255
701,Postcentral sulcus mid-superior RH,中央后沟中部上部右侧,107,92,242,255
702,Medulla oblongata anterior,延髓前部,108,92,242,255
703,Precuneus superior,楔前叶上部,109,92,242,255
704,Anterior vertical ramus of the Lateral fissure RH,外侧裂前垂直支右侧,109,92,242,255
705,Inferior fronto-occipital fasciculus mid-posterior RH,额枕束中后部右侧,110,92,242,255
706,Cingulate posterior LH,扣带后部左侧,111,92,242,255
707,Cingulate middle RH,扣带中部右侧,112,92,242,255
708,Calcarine sulcus mid-anterior RH,距状沟中部前侧右侧,113,92,242,255
709,Precentral gyrus inferior LH,中央前回下部左侧,114,92,242,255
710,Posterior orbital gyrus posterior,后眶回后部,115,92,242,255
711,Dorsal visual stream RH,背侧视觉流右侧,116,92,242,255
712,Caudate antero-superior,尾状核前上部,116,92,242,255
713,Superior temporal sulcus postero-superior LH,上颞沟后上部左侧,117,92,242,255
714,Cerebellum V,小脑V,118,92,242,255
715,Subparietal sulcus,顶下沟,119,92,242,255
716,Intraparietal sulcus mid-posterior LH,顶内沟中后部左侧,120,92,242,255
717,Subcallosal cortex superior,胼胝体下皮质上部,121,92,242,255
718,Superior parietal sulcus inferior RH,上顶沟下部右侧,122,92,242,255
719,Cuneus postero-superior LH,楔叶后上部左侧,123,92,242,255
720,Middle temporal gyrus anterior RH,颞中回前部右侧,124,92,242,255
721,Postcentral gyrus superior,中央后回上部,124,92,242,255
722,Precentral sulcus superior LH,中央前沟上部左侧,125,92,242,255
723,Anterior orbital gyrus lateral,前眶回外侧,126,92,242,255
724,Inferior occipital gyrus anterior RH,枕下回前部右侧,127,92,242,255
725,Anterior insula mid-inferior LH,前岛叶中部下侧左侧,128,92,242,255
726,Parahippocampal gyrus middle RH,旁海马回中部右侧,129,92,242,255
727,Central sulcus middle medial RH,中央沟中部内侧右侧,130,92,242,255
728,Pars triangularis anterior LH,三角部前部左侧,131,92,242,255
729,Corpus callosum rostrum,胼胝体嘴部,131,92,242,255
730,Middle frontal gyrus anterior RH,额中回前部右侧,132,92,242,255
731,Cingulate mid-posterior,扣带中后部,133,92,242,255
732,Cerebellum V,小脑V,134,92,242,255
733,Circular sulcus of the insula superior,脑岛上部环状沟,135,92,242,255
734,Middle frontal gyrus mid-posterior LH,额中回中后部左侧,136,92,242,255
735,Pars triangularis posterior LH,三角部后部左侧,137,92,242,255
736,Central sulcus superior LH,中央沟上部左侧,138,92,242,255
737,Interhemispheric fissure precentral gyrus,半球间裂中央前回,138,92,242,255
738,Angular gyrus posterior RH,角回后部右侧,139,92,242,255
739,Arcuate fasciculus posterior LH,弓状束后部左侧,140,92,242,255
740,Corpus callosum isthmus anterior,胼胝体峡部前部,141,92,242,255
741,Anterior cingulate cortex anterior LH,前扣带皮层前部左侧,142,92,242,255
742,Retrocalcarine sulcus LH,距后沟左侧,143,92,242,255
743,Subparietal sulcus posterior,顶下沟后部,144,92,242,255
744,Cerebrospinal fluid (between superior frontal gyrus and skull),额上回与颅骨之间的脑脊液,145,92,242,255
745,Subparietal sulcus anterior LH,顶下沟前部左侧,146,92,242,255
746,Midbrain posterior,中脑后部,146,92,242,255
747,Anterior corona radiata,前部放射冠,147,92,242,255
748,Precuneus interhemispheric fissure,楔前叶大脑纵裂,148,92,242,255
749,Callosomarginal sulcus inferior LH,胼胝体边缘沟下部左侧,149,92,242,255
750,Superior parietal sulcus superior RH,上顶沟上部右侧,150,92,242,255
751,Lateral fissure middle LH,外侧裂中部左侧,151,92,242,255
752,Occipital pole inferior LH,枕极下部左侧,152,92,242,255
753,Precentral sulcus medial RH,中央前沟内侧右侧,153,92,242,255
754,Lingual gyrus anterior LH,舌回前部左侧,153,92,242,255
755,Superior parietal lobule antero-superior RH,上顶叶前上部右侧,154,92,242,255
756,Postcentral sulcus superior LH,中央后沟上部左侧,155,92,242,255
757,Occipitotemporal sulcus posterior LH,颞枕沟后部左侧,156,92,242,255
758,Anterior cingulate cortex,前扣带皮层,157,92,242,255
759,Subcallosal cortex inferior,胼胝体下皮质下部,158,92,242,255
760,Internal capsule genu LH,内囊膝部左侧,159,92,242,255
761,Fusiform gyrus RH,梭状回右侧,160,92,242,255
762,Angular sulcus posterior RH,角沟后部右侧,160,92,242,255
763,Lateral occipital cortex middle RH,枕外侧皮质中部右侧,161,92,242,255
764,Angular gyrus antero-superior RH,角回前上部右侧,162,92,242,255
765,Superior frontal gyrus anterior LH,上额回前部左侧,163,92,242,255
766,Precentral gyrus inferior RH,中央前回下部右侧,164,92,242,255
767,Superior parts of central and postcentral gyrus,中央回和中央后回上部,165,92,242,255
768,Calcarine sulcus middle,距状沟中部,166,92,242,255
769,Superior temporal sulcus postero-superior RH,上颞沟后上部右侧,167,92,242,255
770,Forceps major posterior,大钳后部,168,92,242,255
771,Angular gyrus posterior LH,角回后部左侧,168,92,242,255
772,Anterior horizontal ramus of the lateral fissure LH,外侧裂前水平支左侧,169,92,242,255
773,Inferior frontal sulcus middle RH,额下沟中部右侧,170,92,242,255
774,Calcarine sulcus anterior RH,距状沟前部右侧,171,92,242,255
775,Callosomarginal sulcus inferior RH,胼胝体边缘沟下部右侧,172,92,242,255
776,Middle frontal gyrus mid-anterior inferior RH,额中回中前下部右侧,173,92,242,255
777,Superior occipital sulcus inferior RH,上枕沟下部右侧,174,92,242,255
778,Inferior frontal sulcus posterior RH,额下沟后部右侧,175,92,242,255
779,Circular sulcus of the insula posterior RH,脑岛后部环状沟右侧,175,92,242,255
780,Lingual gyrus middle,舌回中部,176,92,242,255
781,Superior temporal gyrus posterior RH,上颞回后部右侧,177,92,242,255
782,Precuneus antero-inferior RH,楔前叶前下部右侧,178,92,242,255
783,Precentral gyrus superior RH,中央前回上部右侧,179,92,242,255
784,Cerebellum Crus I LH,小脑Crus I左侧,180,92,242,255
785,Corticospinal tract superior RH,皮质脊髓束上部右侧,181,92,242,255
786,Inferior temporal sulcus posterior RH,颞下沟后部右侧,182,92,242,255
787,Dorsomedial prefrontal cortex antero-superior RH,内侧前额叶皮层前上部右侧,182,92,242,255
788,Middle frontal sulcus middle LH,额中沟中部左侧,183,92,242,255
789,Lingual gyrus mid-posterior LH,舌回中后部左侧,184,92,242,255
790,Lateral fissure anterior LH,外侧裂前部左侧,185,92,242,255
791,Arcuate fasciculus middle LH,弓状束中部左侧,186,92,242,255
792,Superior temporal gyrus middle LH,上颞回中部左侧,187,92,242,255
793,Posterior insula inferior LH,后脑岛下部左侧,188,92,242,255
794,Lunate sulcus inferior LH,月状沟下部左侧,189,92,242,255
795,Occipitotemporal sulcus anterior RH,颞枕沟前部右侧,190,92,242,255
796,Inferior frontal gyrus middle LH,额下回中部左侧,190,92,242,255
797,Precentral gyrus superior and superior frontal gyrus RH,中央前回上部合并额上回右侧,191,92,242,255
798,Ventral striatum RH,腹侧纹状体右侧,192,92,242,255
799,Superior parietal lobule antero-inferior RH,上顶叶前下部右侧,193,92,242,255
800,Fornix antero-superior,穹窿前上部,194,92,242,255
801,Calcarine sulcus anterior,距状沟前部,195,92,242,255
802,Superior frontal gyrus posterior lateral LH,上额回后部外侧左侧,196,92,242,255
803,Superior frontal sulcus posterior LH,上额沟后部左侧,197,92,242,255
804,Lateral orbital gyrus RH,眶外侧回右侧,197,92,242,255
805,Cerebrospinal fluid (between superior occipital gyrus and skull),枕上回与颅骨之间的脑脊液,198,92,242,255
806,Middle frontal gyrus mid-anterior superior RH,额中回中前上部右侧,199,92,242,255
807,Corpus callosum posterior body radiation RH,胼胝体后部辐射右侧,200,92,242,255
808,Corticospinal tract superior,皮质脊髓束上部,201,92,242,255
809,Lateral fissure posterior limb superior RH,外侧裂后肢上部右侧,202,92,242,255
810,Superior parietal lobule postero-superior LH,上顶叶后上部左侧,203,92,242,255
811,Superior parietal sulcus inferior LH,上顶沟下部左侧,204,92,242,255
812,Pons inferior,脑桥下部,204,92,242,255
813,Intraparietal sulcus inferior RH,顶内沟下部右侧,205,92,242,255
814,Anterior occipital sulcus LH,枕前沟左侧,206,92,242,255
815,Cerebellum IX,小脑IX,207,92,242,255
816,Arcuate fasciculus middle RH,弓状束中部右侧,208,92,242,255
817,Occipital pole inferior lateral RH,枕极下部外侧右侧,209,92,242,255
818,Inferior occipital sulcus inferior RH,枕下沟下部右侧,210,92,242,255
819,Cerebrospinal fluid (between middle frontal gyrus posterior and skull LH),额中回后部与颅骨左侧之间的脑脊液,211,92,242,255
820,Suborbital sulcus LH,眶下沟左侧,212,92,242,255
821,Parietal operculum posterior RH,顶叶盖后部右侧,212,92,242,255
822,Lingual gyrus anterior RH,舌回前部右侧,213,92,242,255
823,Occipitotemporal gyrus anterior LH,颞枕回前部左侧,214,92,242,255
824,Subcentral gyrus anterior RH,中央下回前部右侧,215,92,242,255
825,Cerebellum Crus I anterior LH,小脑Crus I前部左侧,216,92,242,255
826,Parieto-occipital sulcus postero-superior RH,顶枕沟后上部右侧,217,92,242,255
827,Temporal pole inferior,颞极下部,218,92,242,255
828,Superior temporal sulcus anterior LH,上颞沟前部左侧,219,92,242,255
829,Forceps major anterior RH,大钳前部右侧,219,92,242,255
830,Heschl's gyrus inferior LH,颞横回下部左侧,220,92,242,255
831,Middle frontal gyrus postero-superior LH,额中回后上部左侧,221,92,242,255
832,Precuneus posterior RH,楔前叶后部右侧,222,92,242,255
833,Calcarine sulcus mid-anterior,距状沟中部前侧,223,92,242,255
834,Middle frontal sulcus mid-anterior LH,额中沟中前部左侧,224,92,242,255
835,Anterior corona radiata superior RH,放射冠前部上部右侧,225,92,242,255
836,Cerebellum Crus I,小脑Crus I,226,92,242,255
837,Frontoparietal operculum LH,额顶岛盖左侧,226,92,242,255
838,Posterior cingulate cortex antero-inferior,后扣带皮层前下部,227,92,242,255
839,Retrocalcarine cortex LH,距后皮质左侧,228,92,242,255
840,Anterior orbital gyrus medial,前眶回内侧,229,92,242,255
841,Posterior orbital gyrus RH,后眶回右侧,230,92,242,255
842,Precentral gyrus superior LH,中央前回上部左侧,231,92,242,255
843,Callosomarginal sulcus mid-inferior,胼胝体边缘沟中部下侧,232,92,242,255
844,Middle frontal sulcus inferior LH,额中沟下部左侧,233,92,242,255
845,Precentral sulcus inferior RH,中央前沟下部右侧,234,92,242,255
846,Cuneus superior,楔叶上部,234,92,242,255
847,Postcentral gyrus superior RH,中央后回上部右侧,235,92,242,255
848,Paracingulate sulcus superior RH,扣带回旁沟上部右侧,236,92,242,255
849,Parieto-occipital sulcus,顶枕沟,237,92,242,255
850,Angular sulcus mid-posterior RH,角沟中部后侧右侧,238,92,242,255
851,Putamen anterior LH,壳核前部左侧,239,92,242,255
852,Angular gyrus antero-inferior LH,角回前下部左侧,240,92,242,255
853,Superior longitudinal fasciculus III posterior RH,上纵束III后部右侧,241,92,242,255
854,Supramarginal gyrus postero-inferior LH,缘上回后下部左侧,241,92,242,255
855,Inferior temporal sulcus mid-anterior LH,颞下沟中前部左侧,242,92,241,255
856,Superior frontal sulcus anterior LH,上额沟前部左侧,242,92,240,255
857,Cerebellum IV LH,小脑IV左侧,242,92,239,255
858,Anterior occipital sulcus posterior RH,枕前沟后部右侧,242,92,239,255
859,Circular sulcus of the insula antero-superior LH,脑岛前上部环状沟左侧,242,92,238,255
860,Precuneus antero-superior LH,楔前叶前上部左侧,242,92,237,255
861,Anterior corona radiata mid-inferior LH,放射冠前部中部下侧左侧,242,92,236,255
862,Cerebellar peduncle,小脑脚,242,92,235,255
863,Lateral occipital cortex mid-superior RH,枕外侧皮质中上部右侧,242,92,234,255
864,Paracentral sulcus inferior,旁中央沟下部,242,92,233,255
865,Precuneus postero-inferior LH,楔前叶后下部左侧,242,92,232,255
866,Intraparietal sulcus mid-anterior LH,顶内沟中前部左侧,242,92,231,255
867,Subparietal sulcus inferior RH,顶下沟下部右侧,242,92,231,255
868,Middle parts of postcentral gyrus and precentral gyrus RH,中央后回和中央前回中部右侧,242,92,230,255
869,Paracingulate gyrus middle,扣带回旁回中部,242,92,229,255
870,Precentral sulcus inferior LH,中央前沟下部左侧,242,92,228,255
871,Inferior longitudinal fasciculus anterior,下纵束前部,242,92,227,255
872,Corpus callosum splenium RH,胼胝体压部右侧,242,92,226,255
873,Cerebellum VI RH,小脑VI右侧,242,92,225,255
874,Hippocampus middle RH,海马中部右侧,242,92,224,255
875,Pars orbitalis RH,眶部右侧,242,92,224,255
876,Forceps minor posterior LH,小钳后部左侧,242,92,223,255
877,Hippocampus anterior LH,海马前部左侧,242,92,222,255
878,Superior parietal sulcus mid-inferior LH,上顶沟中部下左侧,242,92,221,255
879,Middle frontal sulcus middle RH,额中沟中部右侧,242,92,220,255
880,Ventromedial prefrontal cortex antero-inferior,腹内侧前额叶皮层前下部,242,92,219,255
881,Cerebellum Crus I RH,小脑Crus I右侧,242,92,218,255
882,Superior occipital gyrus inferior RH,上枕回下部右侧,242,92,217,255
883,Superior frontal sulcus mid-anterior LH,上额沟中部前左侧,242,92,217,255
884,Supramarginal gyrus superior LH,缘上回上部左侧,242,92,216,255
885,Middle temporal gyrus posterior inferior LH,颞中回后部下部左侧,242,92,215,255
886,External capsule LH,外囊左侧,242,92,214,255
887,Lateral occipital cortex antero-inferior LH,枕外侧皮质前下部左侧,242,92,213,255
888,Precentral gyrus middle LH,中央前回中部左侧,242,92,212,255
889,Cerebellum IX,小脑IX,242,92,211,255
890,Putamen anterior,壳核前部,242,92,210,255
891,Cerebellum V RH,小脑V右侧,242,92,209,255
892,Angular gyrus mid-posterior RH,角回中部后侧右侧,242,92,209,255
893,Cerebellum V,小脑V,242,92,208,255
894,Lateral occipital cortex middle LH,枕外侧皮质中部左侧,242,92,207,255
895,Middle frontal gyrus lateral RH,额中回外侧右侧,242,92,206,255
896,Lingual gyrus medial,舌回内侧,242,92,205,255
897,Cerebellum V,小脑V,242,92,204,255
898,Collateral sulcus mid-posterior LH,外侧沟后部左侧,242,92,203,255
899,Occipital pole inferior,枕极下部,242,92,202,255
900,Superior longitudinal fasciculus II mid-posterior LH,上纵束II中部后左侧,242,92,202,255
901,Cerebellum Crus II LH,小脑Crus II左侧,242,92,201,255
902,Cingulate gyrus mid-posterior,扣带回中后部,242,92,200,255
903,Precuneus anterior,楔前叶前部,242,92,199,255
904,Parieto-occipital sulcus posterior RH,顶枕沟后部右侧,242,92,198,255
905,Lateral occipital sulcus mid-posterior RH,枕外侧沟中后部右侧,242,92,197,255
906,Superior frontal gyrus medial mid-anterior LH,上额回内侧中部前左侧,242,92,196,255
907,Paracentral sulcus superior,旁中央沟上部,242,92,195,255
908,Optic radiation posterior LH,视辐射后部左侧,242,92,195,255
909,Supramarginal gyrus posterior LH,缘上回后部左侧,242,92,194,255
910,Cerebellum horizontal fissure,小脑水平裂,242,92,193,255
911,Corticospinal tract LH,皮质脊髓束左侧,242,92,192,255
912,Cerebellum VI RH,小脑VI右侧,242,92,191,255
913,Lingual gyrus anterior,舌回前部,242,92,190,255
914,Cuneus antero-superior RH,楔叶前上部右侧,242,92,189,255
915,Postcentral gyrus middle posterior LH,中央后回中部后部左侧,242,92,188,255
916,Pars opercularis inferior LH,岛盖部下部左侧,242,92,187,255
917,Fornix middle body,穹窿中间体,242,92,187,255
918,Subparietal sulcus posterior RH,顶下沟后部右侧,242,92,186,255
919,Cingulate sulcus posterior RH,扣带沟后部右侧,242,92,185,255
920,Cerebellum VIIb,小脑VIIb,242,92,184,255
921,Anterior corona radiata anterior RH,放射冠前部前侧右侧,242,92,183,255
922,Corticospinal tract precentral gyrus LH,中央前回皮质脊髓束左侧,242,92,182,255
923,Superior occipital sulcus superior LH,上枕沟上部左侧,242,92,181,255
924,Inferior frontal gyrus mid-anterior RH,额下回中前部右侧,242,92,180,255
925,Superior temporal sulcus mid-posterior RH,上颞沟中部后右侧,242,92,180,255
926,Cerebrospinal fluid (between postcentral gyrus inferior and skull LH),中央后回下部与颅骨左侧之间的脑脊液,242,92,179,255
927,Superior occipital gyrus mid-superior,上枕回中部上部,242,92,178,255
928,Angular sulcus posterior LH,角沟后部左侧,242,92,177,255
929,Middle frontal gyrus lateral LH,额中回外侧左侧,242,92,176,255
930,Cerebellum VI LH,小脑VI左侧Cerebellum VI RH,242,92,175,255
931,Cerebellum VI anterior,小脑VI前部,242,92,174,255
932,Occipitotemporal gyrus posterior RH,颞枕回后部右侧,242,92,173,255
933,Cerebellum V RH,小脑V右侧,242,92,173,255
934,Frontal pole superior RH,额极上部右侧,242,92,172,255
935,Corpus callosum tapetum,胼胝体毯部,242,92,171,255
936,Central sulcus middle RH,中央沟中部右侧,242,92,170,255
937,Collateral sulcus posterior RH,外侧沟后部右侧,242,92,169,255
938,Superior temporal gyrus mid-posterior RH,上颞回中部后右侧,242,92,168,255
939,Parieto-occipital sulcus anterior LH,顶枕沟前部左侧,242,92,167,255
940,Supramarginal gyrus anterior RH,缘上回前部右侧,242,92,166,255
941,Parieto-occipital sulcus postero-superior,顶枕沟后上部,242,92,165,255
942,Cerebral peduncles superior,大脑脚上部,242,92,165,255
943,Inferior frontal sulcus posterior superior LH,额下沟后上部左侧,242,92,164,255
944,Frontal pole mid-superior RH,额极中上部右侧,242,92,163,255
945,Supramarginal gyrus postero-superior LH,缘上回后上部左侧,242,92,162,255
946,Inferior frontal sulcus posterior inferior LH,额下沟后下部左侧,242,92,161,255
947,Callosal sulcus posterior,胼胝体沟后部,242,92,160,255
948,Cerebrospinal fluid (between superior frontal gyrus and skull LH),额上回与颅骨左侧之间的脑脊液,242,92,159,255
949,Superior longitudinal fasciculus III mid-anterior LH,上纵束III中部前左侧,242,92,158,255
950,Anterior thalamic radiation antero-superior RH,丘脑辐射前上部右侧,242,92,158,255
951,Angular gyrus mid-anterior RH,角回中部前侧右侧,242,92,157,255
952,Planum temporale LH,颞平面左侧,242,92,156,255
953,Interhemispheric fissure superior,半球间裂上部,242,92,155,255
954,Superior parietal lobule posterior,上顶叶后部,242,92,154,255
955,Callosomarginal sulcus mid-superior,胼胝体边缘沟中部上侧,242,92,153,255
956,Central sulcus mid-inferior medial RH,中央沟中部下侧内侧右侧,242,92,152,255
957,Forceps minor posterior RH,小钳后部右侧,242,92,151,255
958,Superior longitudinal fasciculus II middle LH,上纵束II中部左侧,242,92,151,255
959,Cerebellum Crus I posterior LH,小脑Crus I后部左侧,242,92,150,255
960,Central sulcus superior RH,中央沟上部右侧,242,92,149,255
961,Interhemispheric fissure parietal,半球间裂顶部,242,92,148,255
962,Paracentral lobule postero-inferior,旁中央小叶后下部,242,92,147,255
963,Precentral sulcus mid-superior LH,中央前沟中部上部左侧,242,92,146,255
964,Cingulum mid-posterior,扣带束中后部,242,92,145,255
965,Paracentral lobule posterior LH,旁中央小叶后部左侧,242,92,144,255
966,Paracingulate sulcus posterior LH,扣带回旁沟后部左侧,242,92,143,255
967,Fornix anterior,穹窿前部,242,92,143,255
968,Callosal sulcus mid-posterior,胼胝体沟中部后侧,242,92,142,255
969,Cingulum mid-posterior LH,扣带束中后部左侧,242,92,141,255
970,Callosomarginal sulcus superior,胼胝体边缘沟上部,242,92,140,255
971,Central sulcus mid-inferior LH,中央沟中部下侧左侧,242,92,139,255
972,Middle temporal gyrus posterior superior LH,颞中回后上部左侧,242,92,138,255
973,Suborbital sulcus,眶下沟,242,92,137,255
974,Middle frontal gyrus posterior superior RH,额中回后上部右侧,242,92,136,255
975,Globus pallidus anterior,苍白球前部,242,92,136,255
976,Lateral orbital gyrus LH,眶外侧回左侧,242,92,135,255
977,Supramarginal gyrus posterior inferior RH,缘上回后下部右侧,242,92,134,255
978,Middle temporal gyrus mid-posterior LH,颞中回中后部左侧,242,92,133,255
979,Superior occipital sulcus superior RH,上枕沟上部右侧,242,92,132,255
980,Inferior frontal gyrus anterior LH,额下回前部左侧,242,92,131,255
981,Posterior insula postero-superior RH,后脑岛后上部右侧,242,92,130,255
982,Cerebellum IX anterior,小脑IX前部,242,92,129,255
983,Inferior temporal sulcus medial LH,颞下沟内侧左侧,242,92,129,255
984,Angular gyrus anterior LH,角回前部左侧,242,92,128,255
985,Cerebellum Crus I RH,小脑Crus I右侧,242,92,127,255
986,Superior parts of central and precentral sulci RH,中央沟和中央前沟上部右侧,242,92,126,255
987,Cerebellum VI RH,小脑VI右侧,242,92,125,255
988,Superior parietal lobule RH,上顶叶右侧,242,92,124,255
989,Superior occipital gyrus RH,上枕回右侧,242,92,123,255
990,Caudate posterior RH,尾状核后部右侧,242,92,122,255
991,Ventromedial prefrontal cortex anterior LH,左腹内侧前额叶皮层前部,242,92,121,255
992,Postcentral sulcus medial,中央后沟内侧,242,92,121,255
993,Cerebellum Crus I LH,小脑Crus I左侧,242,92,120,255
994,Middle frontal sulcus anterior LH,额中沟前部左侧,242,92,119,255
995,Superior occipital sulcus LH,上枕沟左侧,242,92,118,255
996,Cerebellum VI LH,小脑VI左侧Cerebellum VI RH,242,92,117,255
997,Subcentral gyrus posterior RH,中央下回后部右侧,242,92,116,255
998,Superior parietal lobule posterior LH,上顶叶后部左侧,242,92,115,255
999,Cerebellum Crus II RH,小脑Crus II右侧,242,92,114,255
1000,Cingulate gyrus mid-anterior,扣带回中前部,242,92,114,255
1001,Cerebellum VI RH,小脑VI右侧,242,92,113,255
1002,Middle frontal gyrus posterior superior LH,额中回后部上部左侧,242,92,112,255
1003,Cerebellum VI,小脑VI,242,92,111,255
1004,Dorsomedial prefrontal cortex anterior LH,内侧前额叶皮层前部左侧,242,92,110,255
1005,Lunate sulcus superior RH,月状沟上部右侧,242,92,109,255
1006,Temporal pole RH,颞极右侧,242,92,108,255
1007,Cuneus superior RH,楔叶上部右侧,242,92,107,255
1008,Corpus callosum isthmus,胼胝体峡部,242,92,107,255
1009,Cerebellum VI anterior RH,小脑VI前部右侧,242,92,106,255
1010,Inferior frontal sulcus mid-posterior RH,额下沟中后部右侧,242,92,105,255
1011,Superior parietal lobule inferior LH,上顶叶下部左侧,242,92,104,255
1012,Fornix posterior,穹窿后部,242,92,103,255
1013,Lateral occipital sulcus anterior RH,枕外侧沟前部右侧,242,92,102,255
1014,Cerebellum Crus I RH,小脑Crus I右侧,242,92,101,255
1015,Superior frontal sulcus middle RH,上额沟中部右侧,242,92,100,255
1016,Hypothalamus,下丘脑,242,92,99,255
1017,Cingulum anterior,扣带束前回,242,92,99,255
1018,Superior temporal gyrus posterior lateral LH,上颞回后部外侧左侧,242,92,98,255
1019,Superior temporal gyrus anterior RH,上颞回前部右侧,242,92,97,255
1020,Parieto-occipital sulcus anterior RH,顶枕沟前部右侧,242,92,96,255
1021,Cerebellum IX,小脑IX,242,92,95,255
1022,Cuneus postero-inferior LH,楔叶后下部左侧,242,92,94,255
1023,Caudate superior anterior,尾状核上部前侧,242,92,93,255
1024,Corpus callosum genu RH,胼胝体膝部右侧,242,92,92,255
